{
  "schema_version": 1,
  "source": {
    "snapshot_id": "00000000000000000000000000000000",
    "manifest_sha256": "0000000000000000000000000000000000000000000000000000000000000000"
  },
  "target": {
    "snapshot_id": "11111111111111111111111111111111",
    "manifest_sha256": "1111111111111111111111111111111111111111111111111111111111111111"
  },
  "research": {
    "snapshot_id": "22222222222222222222222222222222",
    "manifest_sha256": "2222222222222222222222222222222222222222222222222222222222222222"
  },
  "not_before": "2026-07-29T00:00:00Z",
  "timeframes": [
    "15m"
  ],
  "tables": {
    "canonical_bars": {
      "source_ref_sha256": "3333333333333333333333333333333333333333333333333333333333333333",
      "target_ref_sha256": "4444444444444444444444444444444444444444444444444444444444444444",
      "mode": "native_diff",
      "read_rows_before": 100,
      "read_rows_after": 101,
      "changed_rows": 1,
      "start_ts": "2026-07-30T00:00:00Z",
      "end_ts": "2026-07-30T00:00:00Z"
    }
  },
  "windows": [
    {
      "instrument_id": "FUT_BR",
      "timeframe": "15m",
      "start_ts": "2026-07-30T00:00:00Z",
      "end_ts": "2026-07-31T00:00:00Z"
    }
  ],
  "preserved_prefix_rows": 50,
  "spark_version": "3.5.9",
  "runtime_provenance": {
    "source_sha256": "5555555555555555555555555555555555555555555555555555555555555555"
  },
  "report_sha256": "6666666666666666666666666666666666666666666666666666666666666666"
}
